"pkPonto";"nmPonto";"fkLinha";"hrDePassagem";"hrDePassagemVolta";"fkBairro";"ativo";"usuarioIncluiu";"dataAlteracao"
"1185";"Rod. Rio Santos c/ Trevo de Coroa Grande";"57";"07:20:00.0000000";"NULL";"227";"S";"NULL";"NULL"
"1188";"Rod. Rio Santos c/ Dom Zellitus";"60";"07:20:00.0000000";"NULL";"228";"S";"paulo.thiago";"2024-01-12 00:00:00.000"
"1189";"Rod. Washington Luiz nº106 c/ Passarela Stª. Cruz da Serra";"63";"05:35:00.0000000";"NULL";"780";"S";"NULL";"NULL"
"1191";"Rod. Washington Luiz c/ Churrascaria Três Marias (Passarela)";"63";"05:50:00.0000000";"NULL";"765";"S";"NULL";"NULL"
"1198";"Rodovia Rio Santos Nº4452 c/ PRF";"57";"06:06:00.0000000";"NULL";"309";"S";"NULL";"NULL"
"1200";"Rodovia Rio-Santos com Rua Visconde de Cairu, 8 (Casa de Fogos Stº. Antônio)";"45";"07:16:00.0000000";"NULL";"229";"S";"paulo.thiago";"2023-09-13 00:00:00.000"
"1201";"Rod. Washington Luiz c/ Posto Bravo";"63";"05:45:00.0000000";"NULL";"757";"S";"NULL";"NULL"
"1208";"Rua Alfredo de Morais c/ Churrascaria Brasas Grill";"51";"06:39:00.0000000";"NULL";"129";"S";"NULL";"NULL"
"1211";"Rua Severiano Chagas, 47";"46";"06:50:00.0000000";"NULL";"153";"S";"paulo.thiago";"2024-04-16 00:00:00.000"
"1213";"Rua Ângelo Dantas Nº. 69 c/ Hotel Classic";"54";"06:26:00.0000000";"NULL";"46";"S";"NULL";"NULL"
"1214";"Rua Antônio Marins Oliveira c/ Rua Dr. Luiz Sobral (Praça)";"49";"06:17:00.0000000";"NULL";"659";"S";"NULL";"NULL"
"1215";"Rua Aquidabã  Nº. 965 (Hospital Carmela Dutra)";"54";"05:56:00.0000000";"NULL";"81";"N";"NULL";"NULL"
"1217";"Rua Aricuri, 1766 c/ Rua São Basílio (Próximo ao Bazar Central)";"45";"06:49:00.0000000";"NULL";"129";"S";"paulo.thiago";"2023-09-13 00:00:00.000"
"1218";"Rua Arthur Rios, 126 (Detran)";"47";"06:35:00.0000000";"NULL";"129";"S";"paulo.thiago";"2023-09-13 00:00:00.000"
"1219";"Rua Arthur Rios, 1270";"47";"06:37:00.0000000";"NULL";"129";"S";"paulo.thiago";"2023-09-13 00:00:00.000"
"1220";"Rua Arthur Rios, 1698 (próximo ao Hipertintas)";"47";"06:39:00.0000000";"NULL";"129";"S";"paulo.thiago";"2023-09-13 00:00:00.000"
"1226";"Rua Aurélio Figueiredo próximo ao 114-330 (Marrafas Bike)";"46";"06:22:00.0000000";"NULL";"129";"S";"roberto.silva";"2023-07-28 00:00:00.000"
"1230";"Rua Barão c/ Praça Seca (Loja da Nextel)";"52";"06:06:00.0000000";"NULL";"150";"N";"NULL";"NULL"
"1231";"Rua Barão de Mesquita c/  Rua São Francisco Xavier nº 313";"56";"06:07:00.0000000";"NULL";"78";"S";"NULL";"NULL"
"1232";"Rua Barão de Mesquita c/ Rua José Vicente (Largo do Verdun) ";"56";"05:53:00.0000000";"NULL";"64";"S";"NULL";"NULL"
"1233";"Rua Barão de Mesquita c/ Rua Uruguai (Padaria)";"56";"05:57:00.0000000";"NULL";"109";"S";"NULL";"NULL"
"1234";"Rua Barão de São Francisco, nº350 c/ Rua Barão de Cotegipe";"56";"05:47:00.0000000";"NULL";"118";"S";"NULL";"NULL"
"1235";"Rua Barão de São Francisco nº182 c/ Rua Barão de Vassouras";"56";"05:50:00.0000000";"NULL";"118";"S";"NULL";"NULL"
"1237";"Rua Barata Ribeiro c/ R. Raimundo Corrêa (Hotel Royalty Rio)";"62";"05:41:00.0000000";"NULL";"15";"S";"NULL";"NULL"
"1238";"Rua Barata Ribeiro c/ Rua Ronald de Carvalho";"62";"05:38:00.0000000";"NULL";"15";"S";"NULL";"NULL"
"1240";"Rua Bernardo de Vasconcelos Nº331 c/ Rua da Imperatriz ";"52";"06:30:00.0000000";"NULL";"151";"S";"NULL";"NULL"
"1241";"Rua Bernardo de Vasconcelos c/ Rua Lomas Valentina (Posto Terrana)";"52";"06:31:00.0000000";"NULL";"147";"S";"NULL";"NULL"
"1245";"Rua Borja Reis Nº. 65 (Hotel Sweet lord)";"54";"05:53:00.0000000";"NULL";"81";"N";"NULL";"NULL"
"1247";"Rua Cachambi Nº. 344 (Ponto de ônibus)";"54";"06:11:00.0000000";"NULL";"44";"S";"NULL";"NULL"
"1248";"Rua Cairuçu Nº 284";"52";"06:11:00.0000000";"NULL";"164";"S";"NULL";"NULL"
"1250";"Rua Campo Grande Nº2898 c/ Rua Levino Fânzeres ";"51";"06:44:00.0000000";"NULL";"129";"S";"NULL";"NULL"
"1252";"Rua Campo Grande Nº. 2104 (Conj. Capemi)";"51";"06:42:00.0000000";"NULL";"129";"S";"NULL";"NULL"
"1256";"Rua Cilon Cunha Brum, 560 c/ CIEP Alberto Pasqualini [22°54'47.1""S 43°39'21.0""W]";"51";"06:58:00.0000000";"NULL";"153";"S";"paulo.thiago";"2024-10-30 00:00:00.000"
"1257";"Rua Cilon Cunha Brum, nº34 c/ Escola João Corrêa (Conj. Urucânia)";"51";"06:57:00.0000000";"NULL";"153";"S";"NULL";"NULL"
"1258";"Rua Cilon Cunha Brum c/ Estr. boa Esperança (Ultragás)";"51";"07:00:00.0000000";"NULL";"153";"S";"NULL";"NULL"
"1260";"Rua Conde de Bonfim nº369 (Ponto de ônibus-Banco do Brasil)";"56";"06:03:00.0000000";"NULL";"109";"S";"roberto.silva";"2023-08-08 00:00:00.000"
"1267";"Rua Uranos c/ Rua Dr. Noguchi (Ponto de ônibus Prox. Passarela)";"60";"05:53:00.0000000";"NULL";"98";"S";"NULL";"NULL"
"1271";"Rua Estácio de Sá c Rua Maia de Lacerda (Posto Esso)";"56";"06:15:00.0000000";"NULL";"6";"N";"NULL";"NULL"
"1272";"Rua Felipe Cardoso, 1831 c/ Estação do BRT Cajueiros [22°55'51.2""S 43°40'23.8""W]";"59";"06:51:00.0000000";"NULL";"153";"S";"paulo.thiago";"2024-10-30 00:00:00.000"
"1273";"Rua Felipe Cardoso c/ Hiper Mercado Guanabara";"59";"06:55:00.0000000";"NULL";"153";"S";"NULL";"NULL"
"1278";"Rua Guarujá, 14 (Vergalhão Ferramentas)";"51";"06:49:00.0000000";"NULL";"140";"S";"paulo.thiago";"2024-07-12 00:00:00.000"
"1279";"Rua Guarujá nº351 c/ Estação de Cosmos";"51";"06:52:00.0000000";"NULL";"132";"S";"NULL";"NULL"
"1280";"Rua Guaruja c/ Rua Armando Carneiro Monteiro ";"51";"06:53:00.0000000";"NULL";"132";"S";"NULL";"NULL"
"1282";"Rua Haddock Lobo c/ Rua do Matoso";"56";"06:13:00.0000000";"NULL";"109";"S";"NULL";"NULL"
"1285";"Rua João Vicente 590 (Estação de Oswaldo Cruz)";"54";"06:33:00.0000000";"NULL";"84";"S";"NULL";"NULL"
"1286";"Rua João Vicente Nº. 175 (Colégio Santa Mônica)";"54";"06:28:00.0000000";"NULL";"76";"S";"NULL";"NULL"
"1287";"Rua Lopo Saraiva Nº. 138 (Ponto de Ônibus)";"55";"06:20:00.0000000";"NULL";"148";"S";"NULL";"NULL"
"1295";"Rua Maranhão Nº. 570 (Ponto de Ônibus)";"54";"05:54:00.0000000";"NULL";"81";"N";"NULL";"NULL"
"1296";"Rua Marechal José Beviláqua c/ Rua André Rocha (UPA)";"55";"06:23:00.0000000";"NULL";"159";"S";"NULL";"NULL"
"1305";"Rua Piraquara Nº. 100 (Mat. construção Imperador)";"52";"06:28:00.0000000";"NULL";"151";"S";"NULL";"NULL"
"1306";"Rua Piraquara Nº. 879 (P. ônibus)";"52";"06:26:00.0000000";"NULL";"151";"S";"NULL";"NULL"
"1307";"Rua Prudente de Morais, 1440 c/ Rua Aníbal de Mendonça (Ponto de Ônibus)";"62";"05:50:00.0000000";"NULL";"21";"S";"paulo.thiago";"2024-02-02 00:00:00.000"
"1309";"Rua Rio da Prata, 548";"47";"06:15:00.0000000";"NULL";"123";"S";"paulo.thiago";"2023-09-13 00:00:00.000"
"1310";"Rua Raul Pompéia c/ Rua Júlio de Castilhos";"62";"05:45:00.0000000";"NULL";"15";"S";"NULL";"NULL"
"1314";"Rua Santa Fé Nº. 62 ( Corpo de Bombeiros)";"54";"06:07:00.0000000";"NULL";"81";"S";"NULL";"NULL"
"1315";"Av. Brasil Passarela 07";"56";"06:30:00.0000000";"NULL";"77";"S";"roberto.silva";"2023-07-31 00:00:00.000"
"1316";"Rua São Francisco Xavier, nº2 c/ Rua Conde de Bonfim";"56";"06:11:00.0000000";"NULL";"109";"S";"NULL";"NULL"
"1317";"Rua São Francisco Xavier esquina com Lafayete Cortes";"56";"06:09:00.0000000";"NULL";"78";"S";"NULL";"NULL"
"1320";"Rua Senador Câmara c/ Farmacia Pacheco Nº. 74 ";"46";"06:54:00.0000000";"NULL";"153";"N";"NULL";"NULL"
"1322";"Rua Tibagi, 627";"47";"06:19:00.0000000";"NULL";"123";"S";"paulo.thiago";"2023-09-13 00:00:00.000"
"1323";"Rua Tirol c/ Rua Antônio Cordeiro";"55";"06:09:00.0000000";"NULL";"135";"S";"NULL";"NULL"
"1326";"Rua Ubatuba c/ Estação de Guilherme da Silveira";"52";"06:36:00.0000000";"NULL";"147";"S";"NULL";"NULL"
"1327";"Rua Ubatuba c/ Estação de Padre Miguel";"52";"06:33:00.0000000";"NULL";"147";"S";"NULL";"NULL"
"1328";"Rua Uranos c/ Rua Delfim Carlos (Prox. Instituto 15 de janeiro)";"60";"05:55:00.0000000";"NULL";"83";"N";"NULL";"NULL"
"1329";"Rua Uruguai c/ Rua General Espírito Santo Cardoso (ASSAI)";"56";"05:59:00.0000000";"NULL";"109";"S";"NULL";"NULL"
"1330";"Rua Vinte e Cinco de Agosto c/ R. Sete de Setembro (Maternidade de Xerém)";"63";"05:25:00.0000000";"NULL";"786";"S";"NULL";"NULL"
"1334";"04 - Nova Iguaçu; R. Dr. Curvelo Cavalcante c/ R. Leia Cabral da Cunha (banco Bradesco)";"48";"07:02:00.0000000";"17:02:00.0000000";"NULL";"S";"NULL";"NULL"
"1342";"teste";"56";"23:55:00.0000000";"NULL";"NULL";"S";"NULL";"NULL"
"1345";"Estrada da Posse c/ Clínica da Família(trevo Santíssimo)";"45";"06:25:00.0000000";"NULL";"129";"N";"NULL";"NULL"
"1347";"Av. Glicínia, 451";"46";"06:15:00.0000000";"NULL";"129";"S";"paulo.thiago";"2024-04-16 00:00:00.000"
"1348";"Rua dos Limadores, 159";"47";"06:22:00.0000000";"NULL";"123";"S";"paulo.thiago";"2023-09-13 00:00:00.000"
"1349";"Estr. do Campinho 2726 (Igreja Universal)";"47";"07:00:00.0000000";"NULL";"129";"N";"NULL";"NULL"
"1350";"Estr. da Cachamorra Nº 440 (Ponto de ônibus)";"51";"06:17:00.0000000";"NULL";"129";"S";"NULL";"NULL"
"1353";"R. do Império nº740 c/ R. da Verdade(P. ônibus)";"50";"06:51:00.0000000";"NULL";"153";"S";"NULL";"NULL"
"1354";"R. do Império nº414 c/ Cel. Teixeira Santos (Nacionalgás)";"50";"06:52:00.0000000";"NULL";"153";"S";"NULL";"NULL"
"1355";"Av. Pe. Guilherme Decaminada c/ Lote 14 (P. ônibus - Condomínio Parque recanto verde)";"50";"06:55:00.0000000";"NULL";"153";"S";"paulo.thiago";"2024-06-10 00:00:00.000"
"1358";"Av. Caravellas - Rodoviária de Angra";"57";"05:55:00.0000000";"NULL";"296";"S";"NULL";"NULL"
"1359";"Trevo de Angra dos Reis";"57";"05:58:00.0000000";"NULL";"296";"S";"NULL";"NULL"
"1360";"Rodovia Rio Santos c/ Ponto de Ônibus (Drogaria Bragança)";"57";"06:23:00.0000000";"NULL";"305";"N";"NULL";"NULL"
"1362";"Rod. Rio Santos em frente Delegacia - Pardal";"57";"06:45:00.0000000";"NULL";"239";"S";"lilian.carre";"2023-06-22 00:00:00.000"
"1364";"Rod. Rio Santos Km 423 (Cond. Reserva Ecol. do Sahy)";"57";"06:48:00.0000000";"NULL";"238";"S";"NULL";"NULL"
"1365";"Rod. Rio Santos 426 (Ponto Antes DPO)";"57";"06:51:00.0000000";"NULL";"238";"S";"NULL";"NULL"
"1366";"Posto de Gasolina ALE";"57";"07:02:00.0000000";"NULL";"195";"S";"NULL";"NULL"
"1370";"RJ-106 - Amaral Peixoto (Frente Posto Shell - KM 27)";"65";"04:55:00.0000000";"NULL";"4";"N";"NULL";"NULL"
"1371";"Av. Eugênio Borges c/ Hotel Carinhoso";"65";"05:15:00.0000000";"NULL";"4";"N";"NULL";"NULL"
"1372";"Av. Eugênio Borges c/ R. Dalva Raposo (Lanchonete)";"65";"05:23:00.0000000";"NULL";"4";"N";"NULL";"NULL"
"1373";"Av. Eugênio Borges Nº 269 c/ Estr. Velha de Maricá (Loja Mais Você)";"65";"05:24:00.0000000";"NULL";"199";"N";"NULL";"NULL"
"1375";"Av. Ewerton de C. Xavier c/ Rua Trinta e Um";"65";"05:38:00.0000000";"NULL";"186";"S";"NULL";"NULL"
"1376";"Av. Ewerton de C. Xavier c/ Shopping Ibiza";"65";"05:40:00.0000000";"NULL";"186";"S";"NULL";"NULL"
"1377";"Estr. Francisco da Cruz Nunes, em frente ao Banco Bradesco";"65";"05:45:00.0000000";"NULL";"186";"S";"paulo.thiago";"2023-12-19 00:00:00.000"
"1378";"Estr. Pacheco de Carvalho c/ Policlínica Regional da Largo da Batalha";"65";"05:55:00.0000000";"NULL";"182";"N";"NULL";"NULL"
"1379";"Av. Roberto Silveira c/ Rua 05 de Julho";"65";"06:05:00.0000000";"NULL";"182";"S";"NULL";"NULL"
"1380";"Av. Roberto Silveira, 123 (Estádio Caio Martins)";"65";"06:08:00.0000000";"NULL";"182";"S";"paulo.thiago";"2023-12-19 00:00:00.000"
"1381";"Av. Roberto Silveira, 9 c/ Posto Shell";"65";"06:09:00.0000000";"NULL";"182";"S";"paulo.thiago";"2023-12-19 00:00:00.000"
"1382";"R. Borja Reis 683 (Ponto de Ônibus)";"54";"05:52:00.0000000";"NULL";"81";"S";"NULL";"NULL"
"1383";"R. Pedro de Carvalho Nº 691 (P. ônibus)";"54";"05:58:00.0000000";"NULL";"81";"N";"NULL";"NULL"
"1384";"R. João Vicente (Estação Marechal Hermes)";"54";"06:37:00.0000000";"NULL";"79";"S";"NULL";"NULL"
"1385";"Rua Marquês de Paraná c/ Rua Pastor Manoel A. Souza";"65";"06:10:00.0000000";"NULL";"182";"S";"NULL";"NULL"
"1386";"Av. Jansen de Melo, 360 c/ Posto Ypiranga (Touring)";"65";"06:15:00.0000000";"NULL";"182";"S";"paulo.thiago";"2023-12-19 00:00:00.000"
"1388";"R. Baronesa nº694 c/ Pç. Barão Taquara (CAIXA)";"52";"06:03:00.0000000";"NULL";"150";"N";"NULL";"NULL"
"1391";"Rod. Washington Luiz c/ Prefeitura (Pista descida)";"63";"05:40:00.0000000";"NULL";"780";"S";"NULL";"NULL"
"1392";"Rod. Washington Luiz c/ Posto BR (KM-4)";"63";"05:56:00.0000000";"NULL";"784";"S";"NULL";"NULL"
"1393";"Avenida Brasil c/ Passarela da Cidade Alta";"63";"06:05:00.0000000";"NULL";"54";"S";"NULL";"NULL"
"1394";"Av. Três de Outubro , 439 c/ Rua Pref. Bulcão Viana (Boa Vista Veículos - P. Ônibus)";"61";"05:22:00.0000000";"NULL";"512";"S";"lilian.carre";"2023-06-22 00:00:00.000"
"1395";"R. Domingos Mariano nº 391";"61";"05:25:00.0000000";"NULL";"435";"S";"roberto.silva";"2023-07-31 00:00:00.000"
"1396";"Av. Joaquim Leite nº117 c/ Rodoviária (Igreja Universal)";"61";"05:29:00.0000000";"NULL";"512";"N";"NULL";"NULL"
"1397";"R. Ari Fontenelle Nº 57 (AMPM PNEUS)";"61";"05:30:00.0000000";"NULL";"436";"N";"NULL";"NULL"
"1398";"Rod. Dr. Sergio Braga c/ Sesi";"61";"05:32:00.0000000";"NULL";"415";"N";"NULL";"NULL"
"1399";"Rod. Dr. Sergio Braga c/ Entrada Vila Elmira";"61";"05:35:00.0000000";"NULL";"511";"N";"NULL";"NULL"
"1400";"Rod. Dr. Sergio Braga c/ Nº 951 Mercado Nagumo";"61";"05:38:00.0000000";"NULL";"360";"S";"NULL";"NULL"
"1401";"Rod. Dr. Sergio Braga c/ Passarela da CSN (P. ônibus)";"61";"05:39:00.0000000";"NULL";"349";"S";"lilian.carre";"2024-12-12 00:00:00.000"
"1402";"Praça Juarez Antunes c/ Prédio da CSN";"61";"05:40:00.0000000";"NULL";"405";"S";"NULL";"NULL"
"1403";"Av. Dr. Nelson dos Santos Gonçalves c/ Assembleia de Deus Ministério de Madureira (Praça)";"61";"05:42:00.0000000";"NULL";"405";"S";"lilian.carre";"2023-06-29 00:00:00.000"
"1404";"Rod. dos Metalúrgicos c/ Hospital São João Batista";"61";"05:45:00.0000000";"NULL";"406";"S";"lilian.carre";"2023-06-22 00:00:00.000"
"1405";"Rod. dos Metalúrgicos c/ Viação Agulhas Negras";"61";"05:48:00.0000000";"NULL";"361";"S";"NULL";"NULL"
"1406";"Praça Oscar Rodrigues Cardoso (Jardim Tiradentes - P. de ônibus)";"61";"05:50:00.0000000";"NULL";"361";"S";"lilian.carre";"2023-06-23 00:00:00.000"
"1407";"Rod. dos Metalúrgicos c/ Vila Rica (P. ônibus após rotatória Club de Volta Redonda)";"61";"05:51:00.0000000";"NULL";"404";"S";"lilian.carre";"2023-06-22 00:00:00.000"
"1408";"Rodoviária de Piraí";"61";"06:30:00.0000000";"NULL";"1003";"S";"NULL";"NULL"
"1409";"Pista de Descida da Rod. Pres. Dutra (Viaduto do Cabral - Entrada Paracambi)";"61";"07:05:00.0000000";"NULL";"922";"S";"roberto.silva";"2023-07-31 00:00:00.000"
"1417";"Estr. do Galeão c/ Av. Maestro Paulo e Silva (ASSAI)";"64";"05:49:00.0000000";"NULL";"967";"S";"NULL";"NULL"
"1418";"Av. Ayrton Senna c/ Garagem Transturismo";"58";"07:05:00.0000000";"NULL";"244";"N";"NULL";"NULL"
"1419";"Avenida Pref. Isoldackson Cruz de Brito, 1046 c/ R. Joaquim Ferreira da Costa (Churrascaria 2 Amigos) [22°52'09.8""S 43°47'28.4""W]";"58";"07:13:00.0000000";"NULL";"244";"S";"paulo.thiago";"2024-07-30 00:00:00.000"
"1420";"RJ-99 Lt 3 Qd 4 c/ R. 3 (Antes da linha do trem)";"58";"07:15:00.0000000";"NULL";"244";"S";"NULL";"NULL"
"1421";"Estr. Coronel Pedro Correia, nº74 c/ Posto Shell";"55";"05:43:00.0000000";"NULL";"124";"S";"thiago.luz";"2024-09-18 00:00:00.000"
"1422";"R. Tirol nº606 c/ R. Comandante Rubens Silva";"55";"06:10:00.0000000";"NULL";"135";"S";"NULL";"NULL"
"1423";"R. Bacairis c/ R. Apiacás (Ótica Nogueira)";"55";"06:25:00.0000000";"NULL";"159";"S";"NULL";"NULL"
"1424";"Estr. do Tindiba c/ R. Caituba (P. ônibus prox. CAIXA)";"55";"06:27:00.0000000";"NULL";"159";"S";"NULL";"NULL"
"1426";"Avenida Automóvel Clube,1333 (Batalhão da Polícia Militar de Vilar dos Telles)";"49";"06:00:00.0000000";"NULL";"964";"S";"paulo.thiago";"2024-03-21 00:00:00.000"
"1427";"R. São João Batista Nº562 c/ Igreja Universal";"49";"06:06:00.0000000";"NULL";"964";"S";"NULL";"NULL"
"1428";"R. Gessyr Gonçalves Fontes c/ Praça da Matriz";"49";"06:10:00.0000000";"NULL";"964";"S";"NULL";"NULL"
"1429";"R. Matriz c/ Pç. Coelho da Rocha";"49";"06:23:00.0000000";"NULL";"964";"S";"NULL";"NULL"
"1430";"Av. Benjamim Pinto Dias, 794";"49";"06:27:00.0000000";"NULL";"521";"S";"lilian.carre";"2023-07-03 00:00:00.000"
"1431";"Av. José Mariano Passos, 1725 (Padaria) [22°45'36.9""S 43°24'14.7""W]";"49";"06:32:00.0000000";"NULL";"521";"S";"paulo.thiago";"2024-10-30 00:00:00.000"
"1432";"Av. José Mariano Passos c/ Supermercados Bergs";"49";"06:32:00.0000000";"NULL";"521";"N";"NULL";"NULL"
"1433";"Rod. Pres. Dutra Nº. 13280 (Honda Veículos)";"49";"06:38:00.0000000";"NULL";"717";"S";"NULL";"NULL"
"1434";"Rod. Pres. Dutra c/ Rio Sampa";"49";"06:42:00.0000000";"NULL";"699";"S";"NULL";"NULL"
"1435";"Rod. Pres. Dutra, 3543 (Túnel do Rancho Novo - Próx. Av. Nilo Peçanha) [22°44'59.5""S 43°26'27.4""W]";"49";"06:43:00.0000000";"NULL";"699";"S";"paulo.thiago";"2024-07-16 00:00:00.000"
"1436";"Rod. Pres. Dutra c/ Viaduto da Posse";"49";"06:45:00.0000000";"NULL";"699";"S";"NULL";"NULL"
"1437";"Rodovia Presidente Dura sentido São Paulo frente CIEP 117 Carlos Drumond de Andrade";"49";"06:47:00.0000000";"NULL";"699";"S";"NULL";"NULL"
"1438";"Rod. Pres. Dutra c/ Entrada Cacuia após Saída 183";"49";"06:52:00.0000000";"NULL";"683";"S";"NULL";"NULL"
"1439";"Rod. Pres. Dutra Próximo Ao 978-1098 (Flancar de Iguaçu Veículos e Locações) [22°44'39.0""S 43°30'33.8""W]";"49";"06:55:00.0000000";"NULL";"683";"S";"paulo.thiago";"2024-08-29 00:00:00.000"
"1440";"Rod. Pres. Dutra c/ Ponto próximo a EDURIC";"49";"06:53:00.0000000";"NULL";"683";"S";"paulo.thiago";"2024-08-29 00:00:00.000"
"1441";"Av. Olegário Dias, 2 - 70 (Lanchonete Marajora) [22°43'46.3""S 43°33'50.9""W]";"49";"06:56:00.0000000";"NULL";"845";"S";"paulo.thiago";"2024-09-02 00:00:00.000"
"1444";"Autoestrada Lagoa-Barra c/ S. Conrado Fashion Mall";"59";"05:45:00.0000000";"NULL";"28";"N";"NULL";"NULL"
"1447";"Rua Barão de Mesquita, 777";"56";"05:52:00.0000000";"NULL";"109";"S";"NULL";"NULL"
"1448";"R. Doutor Continentino, 853 c/ R. Felipe Cardoso (Novolks)";"46";"06:48:00.0000000";"NULL";"153";"S";"paulo.thiago";"2024-04-16 00:00:00.000"
"1449";"Avenida Governador Leonel de Moura Brizola, 3133 (Passarela Cemitério do corte 8)";"58";"06:05:00.0000000";"NULL";"756";"S";"paulo.thiago";"2024-11-05 00:00:00.000"
"1450";"Rua Cameron c/ Estr. Velha do Iguaçu";"53";"05:55:00.0000000";"NULL";"723";"N";"NULL";"NULL"
"1451";"Av. Carlos Marques Rollo, 1014 c/ Rua Lampadosa (Esq. Padaria)";"53";"06:10:00.0000000";"NULL";"723";"S";"paulo.thiago";"2024-04-05 00:00:00.000"
"1453";"R. Cacequi c/ R. Camaquã";"60";"06:03:00.0000000";"NULL";"43";"S";"NULL";"NULL"
"1457";"Rua Barata Ribeiro c/ Praça Inhangá, Nº. 89";"62";"05:39:00.0000000";"NULL";"15";"S";"NULL";"NULL"
"1458";"Rua Treze - Gleba A c/ Rua Oito ";"29";"07:30:00.0000000";"NULL";"226";"S";"NULL";"NULL"
"1459";"Rua Dezesseis nº722 c/ Rua Dezessete ";"29";"07:26:00.0000000";"NULL";"226";"N";"NULL";"NULL"
"1460";"Rua Oito c/ Rua Um (Prox. Brizolão)";"29";"07:32:00.0000000";"NULL";"226";"S";"NULL";"NULL"
"1461";"Rua das Rosas c/ Rua das Camélias";"29";"07:35:00.0000000";"NULL";"233";"S";"NULL";"NULL"
"1462";"Rod. Rio-Santos, 2320-2454 c/ Estrada de Chaperó (Antigo Posto Sagário)";"60";"07:15:00.0000000";"NULL";"1502";"S";"paulo.thiago";"2024-01-12 00:00:00.000"
"1463";"Estr. do Mazomba c/ Assembleia de Deus";"29";"07:10:00.0000000";"NULL";"233";"S";"NULL";"NULL"
"1466";"Estr. Rio-São Paulo c/ Rua Cyrios (Ponto de ônibus)";"48";"06:39:00.0000000";"NULL";"712";"N";"NULL";"NULL"
"1470";"Estr. Francisco da Cruz Nunes, em frente ao 12º BPM";"65";"05:46:00.0000000";"NULL";"170";"S";"paulo.thiago";"2023-12-19 00:00:00.000"
"1471";"Estr. do Mazomba c/ Conjunto Sto. Antônio";"29";"07:11:00.0000000";"NULL";"233";"S";"NULL";"NULL"
"1472";"Estr. do Mazomba c/ R. Vinte e Nove (Super Rede)";"29";"07:12:00.0000000";"NULL";"233";"S";"NULL";"NULL"
"1473";"Estr. do Monteiro nº 955 (Marphisa Auto Peças)";"51";"06:28:00.0000000";"NULL";"129";"S";"NULL";"NULL"
"1474";"Estr. do Mato Alto c/ Rua Irlando Regis (Posto BR)";"51";"06:23:00.0000000";"NULL";"129";"S";"NULL";"NULL"
"1475";"Estr. do Mato Alto c/ Comlurb (Ponto de Onibus)";"51";"06:25:00.0000000";"NULL";"129";"S";"NULL";"NULL"
"1476";"Rua João Vicente 1121 (Estação Bento Ribeiro ? Ponto de ônibus)";"54";"06:35:00.0000000";"NULL";"41";"S";"NULL";"NULL"
"1477";"Rod. Presidente Dutra (após entrada de Roma 1)";"61";"06:05:00.0000000";"NULL";"383";"S";"NULL";"NULL"
"1478";"Rua Emídio Lemos c/ Nº. 416 (Colégio Cenec)";"29";"07:00:00.0000000";"NULL";"1001";"S";"lilian.carre";"2024-04-11 00:00:00.000"
"1479";"Rua Rosaria Loureiro c/ Nº. 228 (Posto Ipiranga)";"29";"07:00:00.0000000";"NULL";"1001";"S";"lilian.carre";"2024-04-11 00:00:00.000"
"1481";"R. Washington, 1 Referência - Refrigeração Automotiva";"52";"07:14:00.0000000";"NULL";"224";"S";"NULL";"NULL"
"1482";"Estr. de Jacarepaguá c/ 1º ponto após o retorno";"55";"06:00:00.0000000";"NULL";"135";"S";"NULL";"NULL"
"1483";"Rod. Pres. Dutra c/ 1 ponto antes do pedágio (Mercearia Amor de Mãe)";"29";"06:50:00.0000000";"NULL";"NULL";"S";"NULL";"NULL"
"1484";"Rod. Pres. Dutra c/ 1 Ponto Antes do Pedágio";"29";"06:35:00.0000000";"NULL";"1007";"S";"NULL";"NULL"
"1485";"Avenida dos Mananciais, nº771 c/ Estrada da Soca ( Apenas embarque)";"55";"06:30:00.0000000";"NULL";"159";"S";"NULL";"NULL"
"1486";"Avenida das Américas c/ Colégio Bahiense";"59";"06:07:00.0000000";"NULL";"124";"S";"NULL";"NULL"
"1488";"Rua Conde de Bonfim c/ Rua Itacuruça (Metrô Uruguai B)";"56";"06:01:00.0000000";"NULL";"109";"N";"NULL";"NULL"
"1489";"Rua Aricuri próximo ao 678 (Praça do Magali)";"45";"06:47:00.0000000";"NULL";"129";"S";"roberto.silva";"2023-07-28 00:00:00.000"
"1491";"MEIOS PRÓPRIOS";"40";"23:50:00.0000000";"NULL";"NULL";"S";"NULL";"NULL"
"1492";"Av. Albérico Diniz c/ Centro educacional Pinheiro Ramos";"55";"06:42:00.0000000";"NULL";"143";"S";"NULL";"NULL"
"1493";"Av. Niemeyer, 925 (Cond. Praia das Conchas)";"59";"05:43:00.0000000";"NULL";"28";"N";"NULL";"NULL"
"1496";"Estr. do Curtume c/ Colégio José Maria de Brito";"41";"07:00:00.0000000";"NULL";"1005";"S";"NULL";"NULL"
"1497";"Estr. do Curtume c/ Bar do Malaquias";"41";"07:02:00.0000000";"NULL";"1005";"S";"NULL";"NULL"
"1498";"Avenida Francisco Bicalho c/ Abaixo do Viaduto da Linha vermelha";"56";"06:19:00.0000000";"NULL";"1006";"S";"NULL";"NULL"
"1499";"Avenida das Américas c/ BRT DOM BOSCO";"59";"06:25:00.0000000";"NULL";"152";"S";"NULL";"NULL"
"1501";"Estrada do Campinho, 7120 (Estr. de Paciência (Pto de ônibus))";"45";"07:04:00.0000000";"NULL";"129";"S";"paulo.thiago";"2023-09-13 00:00:00.000"
"1503";"Estr. do Magarça Nº 1870 (Cond. Caminho do Park)";"50";"05:53:00.0000000";"NULL";"139";"N";"NULL";"NULL"
"1504";"Estr. São Tarcísio, nº121 c/ Travessa Jose Florentino";"50";"06:25:00.0000000";"NULL";"157";"S";"NULL";"NULL"
"1505";"Estr. Aterrado do Leme Nº 99 (Salão de festas Eloa)";"51";"07:01:00.0000000";"NULL";"153";"S";"NULL";"NULL"
"1507";"Rua Prudente de Morais c/ R. Maria Quitéria (Everest Rio Hotel)";"62";"05:49:00.0000000";"NULL";"NULL";"S";"NULL";"NULL"
"1508";"Rua Prudente de Morais c/ R. Maria Quiteria (Everest Rio Hotel)";"62";"05:49:00.0000000";"NULL";"21";"S";"NULL";"NULL"
"1510";"Estr. do Timbó c/ Av. Itaóca (Prezunic)";"60";"05:48:00.0000000";"NULL";"42";"S";"NULL";"NULL"
"1511";"R. Euzébio de Almeida,1645 (P.ônibus após IGUI piscinas)";"55";"06:40:00.0000000";"NULL";"143";"S";"NULL";"NULL"
"1512";"Rua Quatorze c/ Escola Municipal Sylvia Souza Siquineli ";"29";"07:20:00.0000000";"NULL";"226";"S";"NULL";"NULL"
"1513";"Avenida Brasil c/ Posto Shell (DEODORO)";"60";"06:30:00.0000000";"NULL";"134";"S";"NULL";"NULL"
"1514";"Rodovia Amaral Peixoto Km 15 c/ Supermercado Multimarket";"65";"05:05:00.0000000";"NULL";"957";"N";"NULL";"NULL"
"1515";"Estrada da Pedra c/ Estrada da Fita (JLV Gesso)";"59";"06:49:00.0000000";"NULL";"139";"S";"paulo.thiago";"2023-12-08 00:00:00.000"
"1516";"Estrada do Campinho, 6246 (E.M. Francisco Jose de Moraes)					";"45";"07:03:00.0000000";"NULL";"129";"S";"paulo.thiago";"2023-09-13 00:00:00.000"
"1517";"Estr. Lagoa Nova / Prox. a Estr. do Caçador";"29";"06:57:00.0000000";"NULL";"226";"S";"NULL";"NULL"
"1518";"Avenida das Américas, Ponto de ônibus. Referência: em frente a Estação BRT Interlagos";"59";"06:10:00.0000000";"NULL";"124";"S";"NULL";"NULL"
"1519";"R. Dr. Curvelo Cavalcante, 409 c/ Supermercado Berg's (P.ônibus)";"53";"07:29:00.0000000";"NULL";"244";"S";"paulo.thiago";"2024-04-05 00:00:00.000"
"1520";"Rod Pres. Dutra c/ Posto Shell 4 irmãos ";"61";"06:07:00.0000000";"NULL";"1003";"S";"NULL";"NULL"
"1521";"Estr. de Piranema Nº 639 c/ R. Fabio Alves (Entrada Boa Fé)";"64";"07:05:00.0000000";"NULL";"913";"S";"NULL";"NULL"
"1522";"Estr. de Piranema C/ Estr. Santa Rosa (Praça de Piranema)";"64";"07:07:00.0000000";"NULL";"1000";"S";"NULL";"NULL"
"1523";"Estr. de Piranema c/ R. Pastor Manoel Matias Vasconcelos (Igreja Batista)";"64";"07:08:00.0000000";"NULL";"1000";"S";"paulo.thiago";"2024-03-20 00:00:00.000"
"1524";"Estr. Rio São Paulo, 4480 c/ Km 49 (Ponto de Ônibus - Primeira Igreja Batista em Seropédica) [22°44'34.5""S 43°42'13.6""W]";"64";"06:47:00.0000000";"NULL";"918";"S";"paulo.thiago";"2024-07-30 00:00:00.000"
"1525";"Estr. Rio São Paulo, 3922 c/ Km 50 (Ponto de Ônibus - Garagem da Expresso Real Rio) [22°44'25.7""S 43°42'22.1""W]";"64";"06:46:00.0000000";"NULL";"918";"S";"paulo.thiago";"2024-07-30 00:00:00.000"
"1526";"Estr. Rio São Paulo c/ Km 54 (Nova Dutra)";"64";"06:42:00.0000000";"NULL";"911";"S";"NULL";"NULL"
"1528";"Rodoviária de Itaguaí - Parque Independência";"48";"07:14:00.0000000";"NULL";"244";"S";"lilian.carre";"2023-07-14 00:00:00.000"
"1529";"Av. Dep. Octávio Cabral, 165 c/ R. Raul Rangel (Concessionária Vadico) [22°52'21.6""S 43°46'24.8""W]";"53";"07:24:00.0000000";"NULL";"244";"S";"paulo.thiago";"2024-07-30 00:00:00.000"
